{"schema_version":"tender_agent_result_v1","field_catalog_version":"tender_fields_v1","field_catalog_sha256":"ABCBEA68911CE9FFAD9D436C9EABE708E12DBC4F04F7D5591CAFE4C58359B843","input_manifest_sha256":"696F8E74FE61DC07D4B69630A5715C70988C48F4F99AE6DA6B49B0234DBD7656","inspected_documents":[{"artifact_key":"doc-0001","inspected_parts":["word/document.xml paragraphs P1-P37","word/document.xml Table 1 rows 1-80","word/footnotes.xml","word/endnotes.xml","word/footer1.xml","OOXML package-part inventory"],"methods":["Direct OOXML text and table inspection with stable paragraph/row locators","OOXML package structure inspection"],"notes":"Technical specification inspected in full. No substantive embedded media was present; only a document thumbnail."},{"artifact_key":"doc-0002","inspected_parts":["word/document.xml paragraphs P1-P161","word/document.xml Tables 1-4","word/footnotes.xml","word/endnotes.xml","word/footer1.xml through word/footer3.xml","word/glossary/document.xml","customXml/item1.xml","OOXML package-part inventory"],"methods":["Direct OOXML text and table inspection with stable paragraph/row locators","OOXML package structure inspection"],"notes":"Draft contract and auxiliary text-bearing parts inspected. Blank template placeholders were retained as blanks, not facts; no substantive embedded media was present."},{"artifact_key":"doc-0003","inspected_parts":["Complete word/document.xml paragraphs P1-P6","Complete OOXML package-part inventory"],"methods":["Direct OOXML paragraph inspection","OOXML package structure inspection"],"notes":"Six-paragraph summary document inspected in full; it contains no tables, auxiliary text parts, or embedded media."}],"limitations":["The draft contract contains a stale heading referring to cleaning supplies, while its operative subject clause, specification, and attached technical-task reference consistently concern furniture; the operative repeated content was used.","The draft contract leaves contract price, VAT rate/status, and specification price cells blank. The only price candidate is sealed metadata max_price, which the catalog does not permit as standalone proof of НМЦ/НДС.","The sealed card and draft contract materially conflict on whether the 47-day delivery period uses working or calendar days.","Document doc-0003 is a short summarization rather than detailed procurement terms and was used only as corroborative source content."],"constraints":["Analysis was restricted to the sealed manifest metadata and three immutable original documents; internet and external tariff/procedure-rule lookups were prohibited.","Null or missing metadata values were treated as unknown, never as negative facts.","Blank template placeholders were not treated as established values."],"fields":[{"field_index":1,"field_key":"procurement_subject","status":"resolved","value_text":"Поставка мебели для образовательного процесса и административно-хозяйственных нужд, а также ремонтные комплекты для мебели","evidence":[{"artifact_key":"tenderplan-metadata","locator":"data.title","quote":"Поставка мебели для образовательного процесса и административно-хозяйственных нужд, а также ремонтные комплекты для мебели"},{"artifact_key":"doc-0001","locator":"word/document.xml, paragraph 4 (Technical specification §1.1)","quote":"Наименование объекта закупки: Поставка мебели для образовательного процесса и административно-хозяйственных нужд, а также ремонтные комплекты для мебели."}],"rationale":"Direct metadata mapping is independently corroborated by the technical specification."},{"field_index":2,"field_key":"nm_price_with_vat","status":"requires_review","value_text":"Кандидат НМЦ: 593 539,08 руб.; сведения об НДС не установлены.","evidence":[{"artifact_key":"tenderplan-metadata","locator":"data.max_price and data.source_payload.tender.maxPrice","quote":"593539.08"},{"artifact_key":"doc-0002","locator":"word/document.xml, paragraph 18 and Table 2 price/VAT columns","quote":"Цена Контракта составляет _____________________ ... в т.ч. НДС____%/без НДС."}],"rationale":"Metadata supplies a max-price candidate, but the catalog allows it only as recheck context and not standalone proof of НМЦК. The draft's price and VAT fields are blank, so amount and VAT status cannot be fully resolved."},{"field_index":3,"field_key":"platform","status":"resolved","value_text":"Портал поставщиков МО — https://zakupki.mos.ru/","evidence":[{"artifact_key":"tenderplan-metadata","locator":"data.platform","quote":"{\"name\":\"Портал поставщиков МО\",\"url\":\"https://zakupki.mos.ru/\"}"},{"artifact_key":"doc-0002","locator":"word/document.xml, paragraph 14 (draft contract subject section)","quote":"Контракт заключен с использованием механизма котировочных сессий на портале Поставщиков автоматизированной информационной системы: https://zakupki.mos.ru"}],"rationale":"The direct metadata mapping is corroborated by the draft contract."},{"field_index":4,"field_key":"procedure_type","status":"resolved","value_text":"Котировочная сессия (закупка малого объёма)","evidence":[{"artifact_key":"doc-0002","locator":"word/document.xml, paragraph 14 (draft contract subject section)","quote":"Контракт заключен с использованием механизма котировочных сессий ... «малого» объёма"},{"artifact_key":"tenderplan-metadata","locator":"data.source_payload.tender.globalSearch (ending)","quote":"Закупка малого объёма"}],"rationale":"The contract supplies the specific mechanism and the metadata independently labels the procurement as small-volume; opaque numeric codes were not interpreted."},{"field_index":5,"field_key":"application_deadline","status":"resolved","value_text":"11.09.2026 07:24:10 UTC","evidence":[{"artifact_key":"tenderplan-metadata","locator":"data.submission_close_at","quote":"2026-09-11T07:24:10.000Z"}],"rationale":"Direct deterministic submission-close mapping; Z normalized as UTC."},{"field_index":6,"field_key":"application_review_date","status":"not_found","value_text":null,"evidence":[],"rationale":"No sealed source identifies a distinct application-review, evaluation, or admission date. The participant evolve timestamp is not expressly labeled as an application-review event."},{"field_index":7,"field_key":"results_date","status":"requires_review","value_text":"События, связанные с выбором победителя: запись победителя — 11.09.2026 07:19:00 UTC; обновление события «protocolsWinners» — 11.09.2026 07:25:58.060 UTC.","evidence":[{"artifact_key":"tenderplan-metadata","locator":"data.source_payload.tender.participants[0]","quote":"{\"evolveDateTime\":1789111140000,\"winner\":true}"},{"artifact_key":"tenderplan-metadata","locator":"data.source_payload.tender.notification","quote":"{\"lastEventType\":\"protocolsWinners\",\"protocolsWinners\":true,\"updateDateTime\":1789111558060}"}],"rationale":"The metadata confirms a winner record and a winners-protocol notification with timestamps, but does not state whether evolveDateTime is the formal winner-determination time or whether notification.updateDateTime is the protocol date; both are retained for review."},{"field_index":8,"field_key":"customer","status":"resolved","value_text":"Муниципальное бюджетное общеобразовательное учреждение «Марковская средняя общеобразовательная школа» (МБОУ «Марковская СОШ»)","evidence":[{"artifact_key":"tenderplan-metadata","locator":"data.primary_customer.name","quote":"МБОУ \"МАРКОВСКАЯ СОШ\""},{"artifact_key":"doc-0002","locator":"word/document.xml, paragraph 7 and Table 1 row 2","quote":"Муниципальное бюджетное общеобразовательное учреждение «Марковская средняя общеобразовательная школа» в дальнейшем по тексту «Заказчик»"}],"rationale":"The draft contract confirms the metadata entity as the contracting customer and provides its full legal name."},{"field_index":9,"field_key":"customer_contacts","status":"resolved","value_text":"Контактное лицо (роль не уточнена): Женихова Наталья Петровна; телефоны: +7 (34241) 9-81-90, 9-81-99; e-mail: mediateka68@mail.ru.","evidence":[{"artifact_key":"doc-0002","locator":"word/document.xml, Table 1 rows 12-14 (Customer details)","quote":"Телефон: +7 (34241) 9-81-90, 9-81-99 | E-mail: mediateka68@mail.ru | Контактное лицо: Женихова Наталья Петровна"}],"rationale":"One confirmed customer contact is listed; the source does not classify the person as procurement or technical contact, so no role was invented."},{"field_index":10,"field_key":"participation_cost","status":"not_found","value_text":null,"evidence":[],"rationale":"No sealed source states a participation fee, commission, tariff, or winner charge. External platform tariffs could not be consulted under the sealed-job constraint."},{"field_index":11,"field_key":"participation_guarantee","status":"not_found","value_text":null,"evidence":[],"rationale":"No source establishes an applicable bid-security requirement, form, or amount. Null guarantee_application metadata was not treated as proof that security is absent."},{"field_index":12,"field_key":"evaluation_criteria","status":"not_found","value_text":null,"evidence":[],"rationale":"No source states evaluation criteria, indicators, weights, points, or comparison rules; a winner price record alone does not prove the governing criterion."},{"field_index":13,"field_key":"delivery_term","status":"requires_review","value_text":"Конфликт источников: карточка — от 1 до 47 рабочих дней; проект договора — в течение 47 календарных дней с момента подписания контракта (начало — с даты заключения).","evidence":[{"artifact_key":"tenderplan-metadata","locator":"data.source_payload.tender.json → general[0].DeliveryTerm","quote":"от 1 до 47 рабочих дней"},{"artifact_key":"doc-0002","locator":"word/document.xml, paragraphs 35-36 (draft contract §§3.1.1-3.1.2)","quote":"Срок поставки товара: в течении 47 (сорок семь) календарных дней с момента подписания Контракта."}],"rationale":"Working days and calendar days are materially inconsistent, so neither source was silently preferred."},{"field_index":14,"field_key":"payment_terms","status":"resolv